,Product name,Prices,Seller Name,URL,Product Code,IMG
0,Tobot Mini Tritan. 1kg can fit 3pcs,39.90,sendy_toys.my,https://shopee.com.my/Tobot-Mini-Tritan.-1kg-can-fit-3pcs-i.265142327.4335886945,i.265142327.4335886945,"=HYPERLINK(""https://cf.shopee.com.my/file/a780f526845fc21bb8e97caa016eb475"")"
1,TAYO TOBOT CHARACTER T SHIRT ROBOCAR POLY CHILDREN 1 7 YEARS,9.71 - 16.24,tokogrosiran.my,https://shopee.com.my/TAYO-TOBOT-CHARACTER-T-SHIRT-ROBOCAR-POLY-CHILDREN-1-7-YEARS-i.253104959.4332102859,i.253104959.4332102859,"=HYPERLINK(""https://cf.shopee.com.my/file/3ff88bf3e8da2b62942f88383505f17e"")"
2,Tobot Machine Warrior mini Adventure X adventure Y adventure W,47.70,zinbaby63.my,https://shopee.com.my/Tobot-Machine-Warrior-mini-Adventure-X-adventure-Y-adventure-W-i.231047344.4318333600,i.231047344.4318333600,"=HYPERLINK(""https://cf.shopee.com.my/file/d23d1fa490b701522edf1d198d5193bf"")"
3,Topper cake Tobot character birthday cake decoration,2.21,apt_store.my,https://shopee.com.my/Topper-cake-Tobot-character-birthday-cake-decoration-i.265020945.4235812577,i.265020945.4235812577,"=HYPERLINK(""https://cf.shopee.com.my/file/c6ab15a1548fb504f37df2956c791529"")"
4,【Ready Stock】tobot 【NEW ARRIVAL】 ♣Mainan Ejen Mini x Ford Max Deformation Full Set Fit Robot Wu Xuan Car x Suit Lucy♣,61.67 - 207.92,xnhswgxkl.my,https://shopee.com.my/%E3%80%90Ready-Stock%E3%80%91tobot-%E3%80%90NEW-ARRIVAL%E3%80%91-%E2%99%A3Mainan-Ejen-Mini-x-Ford-Max-Deformation-Full-Set-Fit-Robot-Wu-Xuan-Car-x-Suit-Lucy%E2%99%A3-i.167385642.4334397844,i.167385642.4334397844,"=HYPERLINK(""https://cf.shopee.com.my/file/bd897fc2cef77109b1c564b0cb116a36"")"
5, Ready Stock tobot mainan budak lelaki excavator ✩Model jentera kejuruteraan mainan penggali besar model simulasi aloi kren kren besar anak lelaki model ekskavator✩,101.32 - 351.67,luruji.my,https://shopee.com.my/-Ready-Stock-tobot-mainan-budak-lelaki-excavator-%E2%9C%A9Model-jentera-kejuruteraan-mainan-penggali-besar-model-simulasi-aloi-kren-kren-besar-anak-lelaki-model-ekskavator%E2%9C%A9-i.161650407.4237415899,i.161650407.4237415899,"=HYPERLINK(""https://cf.shopee.com.my/file/eb431b9425a458e097b83c124394cda4"")"
6,【Ready Stock】 tobot 【NEW ARRIVAL】 Fang Orange serasi dengan teka teki blok bangunan Lego pemasangan mainan transformer bumblebee robot anak lelaki hadiah,94.42 - 315.31,xsbhbvjs.my,https://shopee.com.my/%E3%80%90Ready-Stock%E3%80%91-tobot-%E3%80%90NEW-ARRIVAL%E3%80%91-Fang-Orange-serasi-dengan-teka-teki-blok-bangunan-Lego-pemasangan-mainan-transformer-bumblebee-robot-anak-lelaki-hadiah-i.167346082.4236730311,i.167346082.4236730311,"=HYPERLINK(""https://cf.shopee.com.my/file/606986b074e4c40d6a59cad0ad8a747d"")"
7,Adventure Mini Tobot,19.00,ennieharnitarahman,https://shopee.com.my/Adventure-Mini-Tobot-i.44754111.4335266157,i.44754111.4335266157,"=HYPERLINK(""https://cf.shopee.com.my/file/4e7cb88a52a88db9a5e34f56374a4643"")"
8,TOBOT BACKPACK PRESCHOOL,44.00 - 46.00,ellsa_anna,https://shopee.com.my/TOBOT-BACKPACK-PRESCHOOL-i.229853424.4317800166,i.229853424.4317800166,"=HYPERLINK(""https://cf.shopee.com.my/file/072a0f14215843cb8b0f9f0df336f589"")"
9,Peci Songkok embroidery child tobot tayo upin ipin,14.88,opabaim84.my,https://shopee.com.my/Peci-Songkok-embroidery-child-tobot-tayo-upin-ipin-i.280221650.4241156597,i.280221650.4241156597,"=HYPERLINK(""https://cf.shopee.com.my/file/4693c86eecc45deecdf3044edb8d2bf3"")"
10,TOBOT MAGMA TOYS LIMITED PROMO 6 COOL TO CHANGE AND JOIN,96.84,berlkosmetik4.my,https://shopee.com.my/TOBOT-MAGMA-TOYS-LIMITED-PROMO-6-COOL-TO-CHANGE-AND-JOIN-i.273302103.4251083123,i.273302103.4251083123,"=HYPERLINK(""https://cf.shopee.com.my/file/a14ed5f31dfffd30572262189bd540f0"")"
11,TOBOT MINI Y ORIGINAL ADVENTURE TRANFORMER ROBOT,87.62,toyzgalaxy.my,https://shopee.com.my/TOBOT-MINI-Y-ORIGINAL-ADVENTURE-TRANFORMER-ROBOT-i.267755375.4236642709,i.267755375.4236642709,"=HYPERLINK(""https://cf.shopee.com.my/file/492f6586fe0d24b2bbaf42e15ef44e65"")"
12, Ready Stock tobot mainan budak lelaki ✵26 huruf dinosaur deformasi pendidikan mainan budak lelaki kanak kanak berusia 3 6 tahun robot berkumpul kecerdasan gadis set lengkap✵,105.92 - 377.75,heishezi.my,https://shopee.com.my/-Ready-Stock-tobot-mainan-budak-lelaki-%E2%9C%B526-huruf-dinosaur-deformasi-pendidikan-mainan-budak-lelaki-kanak-kanak-berusia-3-6-tahun-robot-berkumpul-kecerdasan-gadis-set-lengkap%E2%9C%B5-i.149454247.4237411070,i.149454247.4237411070,"=HYPERLINK(""https://cf.shopee.com.my/file/305a2dec3ec394cd63bd5dbd614b9fd8"")"
13,TOBOT TOYS CHILDREN'S ROBOT BECOME CHEAP CAR,26.42,nusajayamart.my,https://shopee.com.my/TOBOT-TOYS-CHILDREN'S-ROBOT-BECOME-CHEAP-CAR-i.270018721.4337570683,i.270018721.4337570683,"=HYPERLINK(""https://cf.shopee.com.my/file/16057a20a9dd58d32e2a7bc67db57a47"")"
14, CAN COD BESTEST !! BAG CHILDREN BACK SCHOOL BAG CHILDREN SCHOOL SD CHARACTER MY LITTLE PONEY TOBOT TAYO,21.11,arisaprizal77.my,https://shopee.com.my/-CAN-COD-BESTEST-!!-BAG-CHILDREN-BACK-SCHOOL-BAG-CHILDREN-SCHOOL-SD-CHARACTER-MY-LITTLE-PONEY-TOBOT-TAYO-i.250618333.4329851567,i.250618333.4329851567,"=HYPERLINK(""https://cf.shopee.com.my/file/02cdde1903c52b7055178601e7741b32"")"
15,【Ready Stock】tobot Mainan robot ☁wifi robot pintar kanak kanak pendidikan awal mesin dialog suara berteknologi tinggi ai kecil belajar teka teki mainan mainan☁,41.76 - 66.29,baoyusn.my,https://shopee.com.my/%E3%80%90Ready-Stock%E3%80%91tobot-Mainan-robot-%E2%98%81wifi-robot-pintar-kanak-kanak-pendidikan-awal-mesin-dialog-suara-berteknologi-tinggi-ai-kecil-belajar-teka-teki-mainan-mainan%E2%98%81-i.180122335.4334397121,i.180122335.4334397121,"=HYPERLINK(""https://cf.shopee.com.my/file/dc975318ab12422fab18838a35c436a8"")"
16,【Ready Stock】tobot Mainan robot ✮Transformers Toys Optimus Bumblebee Car Star Spider Children Robot Boy✮,49.21 - 127.72,yipenga.my,https://shopee.com.my/%E3%80%90Ready-Stock%E3%80%91tobot-Mainan-robot-%E2%9C%AETransformers-Toys-Optimus-Bumblebee-Car-Star-Spider-Children-Robot-Boy%E2%9C%AE-i.178455208.4334397699,i.178455208.4334397699,"=HYPERLINK(""https://cf.shopee.com.my/file/9114f448cdeb967e824da9f1745815dc"")"
17,🌟Ready Stock🌟 1 14 Fr Msia RC Remote CoTransformers Robot Tobot Kereta Toys Birthday Gift Mainan,46.90,iconic.galaxy,https://shopee.com.my/%F0%9F%8C%9FReady-Stock%F0%9F%8C%9F-1-14-Fr-Msia-RC-Remote-CoTransformers-Robot-Tobot-Kereta-Toys-Birthday-Gift-Mainan-i.233252687.4330563148,i.233252687.4330563148,"=HYPERLINK(""https://cf.shopee.com.my/file/ad0b326039ebd008e25910335365567c"")"
18,Mini Tobot Toy,13.88,babebuni_store.my,https://shopee.com.my/Mini-Tobot-Toy-i.267746641.4247534110,i.267746641.4247534110,"=HYPERLINK(""https://cf.shopee.com.my/file/072d04c6c3da60cd33c3b3733d4e294f"")"
19,TOBOT MINI Z ORIGINAL TRANSFORMER ROBOT,87.62,toyzgalaxy.my,https://shopee.com.my/TOBOT-MINI-Z-ORIGINAL-TRANSFORMER-ROBOT-i.267755375.4236642711,i.267755375.4236642711,"=HYPERLINK(""https://cf.shopee.com.my/file/74a79166a4bc63ba5b4e76d406c9eeda"")"
20,TOBOT MINI SERIES TOYS ROBOT TRANSFORMERS MIN 185,13.44,cantikshop.my,https://shopee.com.my/TOBOT-MINI-SERIES-TOYS-ROBOT-TRANSFORMERS-MIN-185-i.265381255.4235921358,i.265381255.4235921358,"=HYPERLINK(""https://cf.shopee.com.my/file/6ddb101b4c696be4433f21a5bf30d7e1"")"
21,PREMIUM Toy Robot Tobot II W Mini Action Figure Deform SNI,33.32 - 34.25,duniacgc.my,https://shopee.com.my/PREMIUM-Toy-Robot-Tobot-II-W-Mini-Action-Figure-Deform-SNI-i.258451038.4244469418,i.258451038.4244469418,"=HYPERLINK(""https://cf.shopee.com.my/file/80891788509aeb453e21c9e3e1f4c723"")"
22,Hippo Class Licensed Cartoon Tobot bonny pokemon Go mcqueen superman,18.48,homaby.my,https://shopee.com.my/Hippo-Class-Licensed-Cartoon-Tobot-bonny-pokemon-Go-mcqueen-superman-i.267265115.4336818894,i.267265115.4336818894,"=HYPERLINK(""https://cf.shopee.com.my/file/33e314305670c70b50cb1a3f5ec9e581"")"
23,Gundam tobot 【Lowest Price】 ✧Mini Q versi SD Gundam BB Unicorn Gundam melaporkan berkabung banshee UC assembled model hand armor explosionable armor✧,79.94 - 95.08,msghdbx.my,https://shopee.com.my/Gundam-tobot-%E3%80%90Lowest-Price%E3%80%91-%E2%9C%A7Mini-Q-versi-SD-Gundam-BB-Unicorn-Gundam-melaporkan-berkabung-banshee-UC-assembled-model-hand-armor-explosionable-armor%E2%9C%A7-i.167377878.4236566048,i.167377878.4236566048,"=HYPERLINK(""https://cf.shopee.com.my/file/72a9e3ba815dd885a5ccfd570729e386"")"
24, Ready Stock tobot mainan budak lelaki ♒Piglet's Racing Little Hero Deformation Rolling Car Racing Tiga Mainan Robot Berubah Transform Watch Summoner♒,119.73 - 322.22,shxlqc.my,https://shopee.com.my/-Ready-Stock-tobot-mainan-budak-lelaki-%E2%99%92Piglet's-Racing-Little-Hero-Deformation-Rolling-Car-Racing-Tiga-Mainan-Robot-Berubah-Transform-Watch-Summoner%E2%99%92-i.193848344.4337415226,i.193848344.4337415226,"=HYPERLINK(""https://cf.shopee.com.my/file/349ee67139f28d269d8f254de09b902a"")"
25, Ready Stock tobot mainan budak lelaki ♘Transformers Toy Optimus Prime Model Kereta Bumblebee Robot Dinosaur Alloy Mainan Anak Lelaki♘,99.79 - 216.68,lzp00107.my,https://shopee.com.my/-Ready-Stock-tobot-mainan-budak-lelaki-%E2%99%98Transformers-Toy-Optimus-Prime-Model-Kereta-Bumblebee-Robot-Dinosaur-Alloy-Mainan-Anak-Lelaki%E2%99%98-i.88261244.4337414903,i.88261244.4337414903,"=HYPERLINK(""https://cf.shopee.com.my/file/665fea54eee889110f936ee09f246848"")"
26, Ready Stock tobot mainan budak lelaki ✴Bantu naga keluar dari kereta ubah bentuk set mainan kanak kanak tiran tongkat naga wes dinosaur penyelamat ekspedisi budak✴,92.09 - 163.52,yqxjmfdc.my,https://shopee.com.my/-Ready-Stock-tobot-mainan-budak-lelaki-%E2%9C%B4Bantu-naga-keluar-dari-kereta-ubah-bentuk-set-mainan-kanak-kanak-tiran-tongkat-naga-wes-dinosaur-penyelamat-ekspedisi-budak%E2%9C%B4-i.193850660.4337410738,i.193850660.4337410738,"=HYPERLINK(""https://cf.shopee.com.my/file/759b2e0a05618715395bc3232dc0a0fb"")"
27,tobot Gundam 【Ready Stock】 ♜Spot Kelas Master MB Avalanche Energy Angel 1 100 Model Gundam Berkumpul 8808 Dengan platform Dengan R2R3♜,323.95 - 391.26,runsuoxin.my,https://shopee.com.my/tobot-Gundam-%E3%80%90Ready-Stock%E3%80%91-%E2%99%9CSpot-Kelas-Master-MB-Avalanche-Energy-Angel-1-100-Model-Gundam-Berkumpul-8808-Dengan-platform-Dengan-R2R3%E2%99%9C-i.178468429.4336565883,i.178468429.4336565883,"=HYPERLINK(""https://cf.shopee.com.my/file/ff3d0431af8fe56603fc4b0ac51ae2db"")"
28, Ready Stock tobot mainan budak lelaki ♭Mini Ejen Mainan X Transformer Robot King Kong Ray x Semifert Lucy Five Dazzle Mecha Suit♭,99.94 - 276.20,shxlqc.my,https://shopee.com.my/-Ready-Stock-tobot-mainan-budak-lelaki-%E2%99%ADMini-Ejen-Mainan-X-Transformer-Robot-King-Kong-Ray-x-Semifert-Lucy-Five-Dazzle-Mecha-Suit%E2%99%AD-i.193848344.4337410409,i.193848344.4337410409,"=HYPERLINK(""https://cf.shopee.com.my/file/a845bab96e9de1353faaa146edb62652"")"
29,tobot gundam hg 【Ready Stock】 【Lowest Price】 ☁Mech Pioneer MG1 100 Red Heresy to Red Puzzle Gundam Model Assembled Toy☁,178.74 - 355.44,jingquanw.my,https://shopee.com.my/tobot-gundam-hg-%E3%80%90Ready-Stock%E3%80%91-%E3%80%90Lowest-Price%E3%80%91-%E2%98%81Mech-Pioneer-MG1-100-Red-Heresy-to-Red-Puzzle-Gundam-Model-Assembled-Toy%E2%98%81-i.250749422.4336572905,i.250749422.4336572905,"=HYPERLINK(""https://cf.shopee.com.my/file/a115ab8833e643bae9941d16c2b89b3d"")"
30,Universe Raider Wild Cow (medium) Tobot Machine Warrior Mini Bigboost Original Price,151.59,mytoyshops.my,https://shopee.com.my/Universe-Raider-Wild-Cow-(medium)-Tobot-Machine-Warrior-Mini-Bigboost-Original-Price-i.195841091.4247501543,i.195841091.4247501543,"=HYPERLINK(""https://cf.shopee.com.my/file/07ac7bdffd254da564818ccba3f22295"")"
31,tobot【Ready Stock】 Mainan robot ♠Robot Deformasi Pasukan Penyelamat Super Giant Asli Genoa Robot Mainan Kanak kanak Burst Sun Charge Fighter King♠,51.29 - 144.70,xnhswgxkl.my,https://shopee.com.my/tobot%E3%80%90Ready-Stock%E3%80%91-Mainan-robot-%E2%99%A0Robot-Deformasi-Pasukan-Penyelamat-Super-Giant-Asli-Genoa-Robot-Mainan-Kanak-kanak-Burst-Sun-Charge-Fighter-King%E2%99%A0-i.167385642.4334397722,i.167385642.4334397722,"=HYPERLINK(""https://cf.shopee.com.my/file/b216c8e91733fbeef21d2707c05cc02d"")"
32,transformers tobot ultraman toy mainan mainan budak lelaki ✹Alphabet Dinosaur Pasukan Digital Deformasi Mainan Robot Kin,32.71 - 130.06,ipjjg4ub1d,https://shopee.com.my/transformers-tobot-ultraman-toy-mainan-mainan-budak-lelaki-%E2%9C%B9Alphabet-Dinosaur-Pasukan-Digital-Deformasi-Mainan-Robot-Kin-i.273726256.4241378341,i.273726256.4241378341,"=HYPERLINK(""https://cf.shopee.com.my/file/f8ae782d9de1793a406f5244cb9a6d27"")"
33, Ready Stock tobot mainan budak lelaki ✸Mainan elektrik kanak kanak merah yang sama Douyin Iron Man menari robot mainan Transformers model mainan✸,105.67 - 113.67,htruoiu21231541.my,https://shopee.com.my/-Ready-Stock-tobot-mainan-budak-lelaki-%E2%9C%B8Mainan-elektrik-kanak-kanak-merah-yang-sama-Douyin-Iron-Man-menari-robot-mainan-Transformers-model-mainan%E2%9C%B8-i.165275309.4237410446,i.165275309.4237410446,"=HYPERLINK(""https://cf.shopee.com.my/file/523b457ee58e5f1c52db6dbcb4105f11"")"
34,【Lowest Price】 gundam hg 【Ready Stock】 tobot ✰Bandai Assembled Model SD EX STANDARD Unicorn Strikes Free Barbatos TRY Burning Gundam✰,151.82,longtengas.my,https://shopee.com.my/%E3%80%90Lowest-Price%E3%80%91-gundam-hg-%E3%80%90Ready-Stock%E3%80%91-tobot-%E2%9C%B0Bandai-Assembled-Model-SD-EX-STANDARD-Unicorn-Strikes-Free-Barbatos-TRY-Burning-Gundam%E2%9C%B0-i.168833722.4336574128,i.168833722.4336574128,"=HYPERLINK(""https://cf.shopee.com.my/file/8b104000087d02095cb287cc42f37d67"")"
35,Backpacks Children Bag Tobot Embos School Bags Children's Backpack Bags Mountain,27.07,iz_room.my,https://shopee.com.my/Backpacks-Children-Bag-Tobot-Embos-School-Bags-Children's-Backpack-Bags-Mountain-i.258504501.4239037524,i.258504501.4239037524,"=HYPERLINK(""https://cf.shopee.com.my/file/6180b6783865c6f5ab02236700ce3ecd"")"
36, Ready Stock tobot mainan budak lelaki excavator ✬Beli satu dapatkan tujuh set kereta mainan penggali yang lebih besar kanak kanak lelaki dan perempuan penggali bayi kanak kanak mainan kereta teknik✬,95.41 - 155.78,yuayea.my,https://shopee.com.my/-Ready-Stock-tobot-mainan-budak-lelaki-excavator-%E2%9C%ACBeli-satu-dapatkan-tujuh-set-kereta-mainan-penggali-yang-lebih-besar-kanak-kanak-lelaki-dan-perempuan-penggali-bayi-kanak-kanak-mainan-kereta-teknik%E2%9C%AC-i.172587755.4237416103,i.172587755.4237416103,"=HYPERLINK(""https://cf.shopee.com.my/file/532f7a20debf007b7f749fd27309847e"")"
37,tobot 【Ready Stock】 【NEW ARRIVAL】 Sesuai dengan blok bangunan Lego Transformers Warrior yang mengumpulkan anggota polis khas tentera yang menguntungkan perisikan makan ayam mainan anak lelaki,107.07,gangtie.my,https://shopee.com.my/tobot-%E3%80%90Ready-Stock%E3%80%91-%E3%80%90NEW-ARRIVAL%E3%80%91-Sesuai-dengan-blok-bangunan-Lego-Transformers-Warrior-yang-mengumpulkan-anggota-polis-khas-tentera-yang-menguntungkan-perisikan-makan-ayam-mainan-anak-lelaki-i.166448252.4236731210,i.166448252.4236731210,"=HYPERLINK(""https://cf.shopee.com.my/file/7b33be4e1fdcf3339f62f5b13ecaddd7"")"
38, Ready Stock tobot mainan budak lelaki excavator ✫Mainan kenderaan kejuruteraan besar set pemadam kebakaran kanak kanak mencampurkan kren penggali jentolak penggali budak pelbagai kereta✫,124.48 - 230.48,gezhichao.my,https://shopee.com.my/-Ready-Stock-tobot-mainan-budak-lelaki-excavator-%E2%9C%ABMainan-kenderaan-kejuruteraan-besar-set-pemadam-kebakaran-kanak-kanak-mencampurkan-kren-penggali-jentolak-penggali-budak-pelbagai-kereta%E2%9C%AB-i.250794880.4237415831,i.250794880.4237415831,"=HYPERLINK(""https://cf.shopee.com.my/file/4991899df6b295081bddf7675c6182a6"")"
39, Ready Stock tobot mainan budak lelaki ♫Youpin Ejen Khas Angkatan Berat Truk Berat Kenderaan Perisai X Ibu Pejabat Trak Deformasi Kereta Kanak kanak Ejen Mini x Mainan♫,107.46 - 185.98,dhgy123.my,https://shopee.com.my/-Ready-Stock-tobot-mainan-budak-lelaki-%E2%99%ABYoupin-Ejen-Khas-Angkatan-Berat-Truk-Berat-Kenderaan-Perisai-X-Ibu-Pejabat-Trak-Deformasi-Kereta-Kanak-kanak-Ejen-Mini-x-Mainan%E2%99%AB-i.165245675.4237414584,i.165245675.4237414584,"=HYPERLINK(""https://cf.shopee.com.my/file/4d4bccb7ab10f39476eb81a9c51a7fc3"")"
40, Ready Stock tobot mainan budak lelaki ✷Optimus Robot Megatron Hornet Stars Ares✷,98.25 - 209.01,htruoiu21231541.my,https://shopee.com.my/-Ready-Stock-tobot-mainan-budak-lelaki-%E2%9C%B7Optimus-Robot-Megatron-Hornet-Stars-Ares%E2%9C%B7-i.165275309.4237411598,i.165275309.4237411598,"=HYPERLINK(""https://cf.shopee.com.my/file/d6f1c86f0a6e45498e6bec420b257310"")"
41,Child Bag and Cap Tobot Thrifty Package,28.88,istanacenter.my,https://shopee.com.my/Child-Bag-and-Cap-Tobot-Thrifty-Package-i.273321181.4338316881,i.273321181.4338316881,"=HYPERLINK(""https://cf.shopee.com.my/file/e52bf4c711e393aff9e1c2ce10e8e7f4"")"
42,mainan tobot iron man ultraman toy ♫Sesuai dengan Lego Avengers Minifigures Marvel blok bangunan Marvel superhero tyrant,82.80,itxq4naot9,https://shopee.com.my/mainan-tobot-iron-man-ultraman-toy-%E2%99%ABSesuai-dengan-Lego-Avengers-Minifigures-Marvel-blok-bangunan-Marvel-superhero-tyrant-i.273728803.4241222211,i.273728803.4241222211,"=HYPERLINK(""https://cf.shopee.com.my/file/51a4f1d757655773ada316c364ec66b7"")"
43,Hot new products 💐BABYWORLD💐Cars Toys Transforming Robot toys Tobot Mini Series kids toys gifts,21.00,deyang2008.my,https://shopee.com.my/Hot-new-products-%F0%9F%92%90BABYWORLD%F0%9F%92%90Cars-Toys-Transforming-Robot-toys-Tobot-Mini-Series-kids-toys-gifts-i.83772182.4248472699,i.83772182.4248472699,"=HYPERLINK(""https://cf.shopee.com.my/file/7b70b162079d1c9f5c2f7156716bea39"")"
44,Tobot mini robot toy Athlon 4 children's educational transformer robot car,20.11,dickyqzink.my,https://shopee.com.my/Tobot-mini-robot-toy-Athlon-4-children's-educational-transformer-robot-car-i.264711878.4335674033,i.264711878.4335674033,"=HYPERLINK(""https://cf.shopee.com.my/file/f0a65d51e3d2db334e32b15201e2f63a"")"
45,MINI TOBOT TRANSFORMABLE ROBOT FIGURE MINI TOBOT TOYS,17.00,maxshop.onlinestore.my,https://shopee.com.my/MINI-TOBOT-TRANSFORMABLE-ROBOT-FIGURE-MINI-TOBOT-TOYS-i.265513381.4335348351,i.265513381.4335348351,"=HYPERLINK(""https://cf.shopee.com.my/file/43ea2431121588c489060b3feeb69e0a"")"
46,Transformers mainan tobot❅Hundred Beast Story Dinosaur Team Super Fight Dragon God Watch Deformation Robot King Kong Mecha Fit Toy❅,113.75 - 529.75,xinyishiyu.my,https://shopee.com.my/Transformers-mainan-tobot%E2%9D%85Hundred-Beast-Story-Dinosaur-Team-Super-Fight-Dragon-God-Watch-Deformation-Robot-King-Kong-Mecha-Fit-Toy%E2%9D%85-i.253101134.4334921481,i.253101134.4334921481,"=HYPERLINK(""https://cf.shopee.com.my/file/7ca343c897399b32f93be30d553e2fed"")"
47,Transformers mainan tobot❈Deformasi Mainan King Kong Bumblebee Police Car Auto Robot Hand Office Model Genuine Boy Tank Children Dinosaur❈,134.55,snfgkh.my,https://shopee.com.my/Transformers-mainan-tobot%E2%9D%88Deformasi-Mainan-King-Kong-Bumblebee-Police-Car-Auto-Robot-Hand-Office-Model-Genuine-Boy-Tank-Children-Dinosaur%E2%9D%88-i.149856201.4334920713,i.149856201.4334920713,"=HYPERLINK(""https://cf.shopee.com.my/file/1837c7f664f5c92a522de5035cec56ca"")"
48,Transformation Robot Car Toys tobot Mini Series Transforming for Boys mainan robot dan kereta boleh ubah kanak kanak,17.90,shaklee_byfieqa,https://shopee.com.my/Transformation-Robot-Car-Toys-tobot-Mini-Series-Transforming-for-Boys-mainan-robot-dan-kereta-boleh-ubah-kanak-kanak-i.3797755.4338311208,i.3797755.4338311208,"=HYPERLINK(""https://cf.shopee.com.my/file/202fae98ebd57aea84ef2d40de8bbd43"")"
49,Transformers mainan tobot✍Mainan Deformasi Jinjiang Hercules King Kong Hexabody Engineering Vehicle Auto Robot Model Gabungan Besar Boy✍,132.47 - 431.99,luzhixing.my,https://shopee.com.my/Transformers-mainan-tobot%E2%9C%8DMainan-Deformasi-Jinjiang-Hercules-King-Kong-Hexabody-Engineering-Vehicle-Auto-Robot-Model-Gabungan-Besar-Boy%E2%9C%8D-i.172580292.4334920417,i.172580292.4334920417,"=HYPERLINK(""https://cf.shopee.com.my/file/bcbb5ae66581ef661255ffa9ae355280"")"
